{"agent":"offline_demo","createdAtUnixMs":1,"expectedProjectRevision":1,"projectId":"prj_00000000000000000000000000000000","records":[{"causedByTurn":0,"kind":{"error":null,"status":"idle","type":"state"},"recordedAtUnixMs":1,"sequence":1},{"causedByTurn":1,"kind":{"prompt":{"context":"Private supplied context","sourceRefs":["source-label"],"text":"PRIVATE_CHAT_CANARY"},"turnId":1,"type":"prompt"},"recordedAtUnixMs":2,"sequence":2},{"causedByTurn":1,"kind":{"type":"update","update":{"connectionId":"00000000000000000000000000000000","kind":{"binding":{"connectionId":"00000000000000000000000000000000","role":"primary","runId":"run_00000000000000000000000000000000","sessionId":"fixture","turnId":1},"status":"running","type":"turn"},"role":"primary","runId":"run_00000000000000000000000000000000","schemaVersion":1,"sequence":1}},"recordedAtUnixMs":3,"sequence":3}],"runId":"run_00000000000000000000000000000000","schemaVersion":1}